{
  "kind": "OperatorInterface",
  "availability": "planned",
  "provider_id": "org.kspacejet.image-ops",
  "operator_id": "image_phase_float32",
  "summary": "Convert one complex image to its real phase image.",
  "ports": [
    {
      "name": "complex_image",
      "direction": "input",
      "semantic_type": "ksj.complex-image-frame"
    },
    {
      "name": "phase_image",
      "direction": "output",
      "semantic_type": "ksj.image-frame"
    }
  ],
  "configuration": {
    "kind": "object",
    "required": [],
    "optional": []
  },
  "notes": "This is a stateless per-image transform. Phase range, zero-magnitude behavior, TypeDescriptor, resources, and terminal behavior await an executable contract."
}
