{
  "kind": "OperatorInterface",
  "availability": "planned",
  "provider_id": "org.kspacejet.image-ops",
  "operator_id": "image_window_float32",
  "summary": "Apply a configured intensity window to one real image.",
  "ports": [
    {
      "name": "image",
      "direction": "input",
      "semantic_type": "ksj.image-frame"
    },
    {
      "name": "windowed_image",
      "direction": "output",
      "semantic_type": "ksj.image-frame"
    }
  ],
  "configuration": {
    "kind": "object",
    "required": ["maximum", "minimum"],
    "optional": []
  },
  "notes": "Exact numerical grammar, endpoint and non-finite behavior, TypeDescriptor, resources, and terminal behavior await an executable contract."
}
